{
  "version": 1,
  "studentId": "danil_kichuk",
  "programVersion": "legacy-fixed-7e706a9be0b8",
  "lessons": [
    {
      "id": "ktp-001",
      "order": 1,
      "plannedDate": "2026-09-30",
      "stageId": "legacy-stage-01",
      "stage": "Адаптация ЕГЭ",
      "block": "Диагностика",
      "topic": "Стартовая калибровка по разбору от 29.09",
      "content": "Разобрать ошибки: теорема Виета, потерянный корень в показательном уравнении, ОДЗ логарифмов, область определения, квадратичная функция, прогрессия, производная, сложные проценты и параметр. Зафиксировать базовую скорость и тип ошибок.",
      "result": "Различать вычислительную ошибку, пробел метода и потерю ограничения; сформировать персональный список контроля.",
      "check": "Различать вычислительную ошибку, пробел метода и потерю ограничения; сформировать персональный список контроля.",
      "homework": "Исправить 9 задач из разбора без подсказок; к каждой выписать контрольный вопрос.",
      "targetCompetencies": []
    },
    {
      "id": "ktp-002",
      "order": 2,
      "plannedDate": "2026-10-02",
      "stageId": "legacy-stage-01",
      "stage": "Адаптация ЕГЭ",
      "block": "Прикладные задачи",
      "topic": "Проценты, пропорции, единицы и округление",
      "content": "Задачи прикладного характера: перевод текста в формулу, проценты, масштаб, единицы, допустимое округление; возврат к сложным процентам из разбора.",
      "result": "Строить математическую модель и проверять размерность и смысл ответа.",
      "check": "Строить математическую модель и проверять размерность и смысл ответа.",
      "homework": "8 прикладных задач: 4 на проценты, 2 на единицы, 2 на округление.",
      "targetCompetencies": []
    },
    {
      "id": "ktp-003",
      "order": 3,
      "plannedDate": "2026-10-07",
      "stageId": "legacy-stage-01",
      "stage": "Адаптация ЕГЭ",
      "block": "Текстовые задачи",
      "topic": "Движение, работа, смеси: выбор модели",
      "content": "Скорость–время–расстояние; совместная работа; концентрации. Выбор переменной и составление уравнения или системы.",
      "result": "Самостоятельно переводить условие в уравнение и проверять физический смысл.",
      "check": "Самостоятельно переводить условие в уравнение и проверять физический смысл.",
      "homework": "6 текстовых задач: 2 движение, 2 работа, 2 смеси.",
      "targetCompetencies": []
    },
    {
      "id": "ktp-004",
      "order": 4,
      "plannedDate": "2026-10-09",
      "stageId": "legacy-stage-01",
      "stage": "Адаптация ЕГЭ",
      "block": "Финансовые задачи",
      "topic": "Финансовые модели: рост, капитализация, платежи",
      "content": "Простой и сложный процент, последовательное изменение величины, базовая логика кредита и вклада; связь с ошибкой по задаче 23 разбора.",
      "result": "Отличать линейное изменение от мультипликативного и строить формулу по годам.",
      "check": "Отличать линейное изменение от мультипликативного и строить формулу по годам.",
      "homework": "5 задач на капитализацию и последовательные проценты.",
      "targetCompetencies": []
    },
    {
      "id": "ktp-005",
      "order": 5,
      "plannedDate": "2026-10-14",
      "stageId": "legacy-stage-01",
      "stage": "Адаптация ЕГЭ",
      "block": "Графики",
      "topic": "Чтение графика функции",
      "content": "Нули, знаки, промежутки возрастания и убывания, экстремумы, значения по графику, пересечения с прямыми.",
      "result": "Извлекать свойства функции из графика без лишних вычислений.",
      "check": "Извлекать свойства функции из графика без лишних вычислений.",
      "homework": "10 коротких заданий на чтение графиков.",
      "targetCompetencies": []
    },
    {
      "id": "ktp-006",
      "order": 6,
      "plannedDate": "2026-10-16",
      "stageId": "legacy-stage-01",
      "stage": "Адаптация ЕГЭ",
      "block": "Графики",
      "topic": "Преобразования графиков и параметры формулы",
      "content": "Сдвиги, растяжения, отражения; квадратичная функция, вершина и выделение полного квадрата — возврат к задаче 14 разбора.",
      "result": "Связывать формулу с геометрией графика и быстро находить ключевые точки.",
      "check": "Связывать формулу с геометрией графика и быстро находить ключевые точки.",
      "homework": "6 задач на преобразования + 3 на параболу.",
      "targetCompetencies": []
    },
    {
      "id": "ktp-007",
      "order": 7,
      "plannedDate": "2026-10-21",
      "stageId": "legacy-stage-01",
      "stage": "Адаптация ЕГЭ",
      "block": "Статистика",
      "topic": "Средние характеристики и представление данных",
      "content": "Среднее арифметическое, медиана, размах; чтение таблиц, диаграмм и выбор статистического показателя.",
      "result": "Вычислять показатель и объяснять, что он сообщает о данных.",
      "check": "Вычислять показатель и объяснять, что он сообщает о данных.",
      "homework": "8 задач на статистику разных форматов.",
      "targetCompetencies": []
    },
    {
      "id": "ktp-008",
      "order": 8,
      "plannedDate": "2026-10-23",
      "stageId": "legacy-stage-01",
      "stage": "Адаптация ЕГЭ",
      "block": "Вероятность",
      "topic": "Классическая вероятность и пространство исходов",
      "content": "Равновозможные исходы, комбинаторный подсчёт простых случаев, событие и противоположное событие.",
      "result": "Строить пространство исходов и не смешивать число исходов с вероятностью.",
      "check": "Строить пространство исходов и не смешивать число исходов с вероятностью.",
      "homework": "10 задач базовой вероятности.",
      "targetCompetencies": []
    },
    {
      "id": "ktp-009",
      "order": 9,
      "plannedDate": "2026-10-28",
      "stageId": "legacy-stage-01",
      "stage": "Адаптация ЕГЭ",
      "block": "Вероятность",
      "topic": "Сложение и умножение вероятностей",
      "content": "Несовместные события, независимость, дерево событий, вероятность хотя бы одного события через дополнение.",
      "result": "Выбирать между суммой, произведением и дополнением.",
      "check": "Выбирать между суммой, произведением и дополнением.",
      "homework": "8 задач: дерево событий и «хотя бы один».",
      "targetCompetencies": []
    },
    {
      "id": "ktp-010",
      "order": 10,
      "plannedDate": "2026-10-30",
      "stageId": "legacy-stage-01",
      "stage": "Адаптация ЕГЭ",
      "block": "Вероятность",
      "topic": "Сложная вероятность: условные сценарии",
      "content": "Зависимые испытания без возвращения, условные ветви, многошаговые эксперименты; задачи повышенной сложности.",
      "result": "Корректно обновлять пространство исходов после первого события.",
      "check": "Корректно обновлять пространство исходов после первого события.",
      "homework": "6 сложных вероятностных задач.",
      "targetCompetencies": []
    },
    {
      "id": "ktp-011",
      "order": 11,
      "plannedDate": "2026-11-04",
      "stageId": "legacy-stage-01",
      "stage": "Адаптация ЕГЭ",
      "block": "Векторы",
      "topic": "Координаты и действия с векторами",
      "content": "Координаты вектора, длина, сумма, разность, умножение на число, середина отрезка.",
      "result": "Выполнять векторные вычисления и переводить геометрию в координаты.",
      "check": "Выполнять векторные вычисления и переводить геометрию в координаты.",
      "homework": "10 коротких задач на координаты и длины.",
      "targetCompetencies": []
    },
    {
      "id": "ktp-012",
      "order": 12,
      "plannedDate": "2026-11-06",
      "stageId": "legacy-stage-01",
      "stage": "Адаптация ЕГЭ",
      "block": "Векторы",
      "topic": "Скалярное произведение и угол",
      "content": "Скалярное произведение, перпендикулярность, косинус угла, проекции; применение к геометрическим задачам.",
      "result": "Находить угол и перпендикулярность через координаты.",
      "check": "Находить угол и перпендикулярность через координаты.",
      "homework": "8 задач, включая 3 геометрических применения.",
      "targetCompetencies": []
    },
    {
      "id": "ktp-013",
      "order": 13,
      "plannedDate": "2026-11-11",
      "stageId": "legacy-stage-01",
      "stage": "Адаптация ЕГЭ",
      "block": "Рациональные уравнения",
      "topic": "ОДЗ, факторизация, замены",
      "content": "Дробно-рациональные уравнения: ограничения, общий знаменатель, разложение на множители, замены; контроль посторонних и потерянных корней.",
      "result": "Начинать решение с ограничений и завершать проверкой каждого корня.",
      "check": "Начинать решение с ограничений и завершать проверкой каждого корня.",
      "homework": "6 уравнений разными методами.",
      "targetCompetencies": []
    },
    {
      "id": "ktp-014",
      "order": 14,
      "plannedDate": "2026-11-13",
      "stageId": "legacy-stage-01",
      "stage": "Адаптация ЕГЭ",
      "block": "Рациональные уравнения",
      "topic": "Рациональные уравнения с модулем",
      "content": "Разбиение на случаи, критические точки модуля, рациональная часть и ОДЗ внутри каждого случая.",
      "result": "Корректно организовывать случаи и отбрасывать решения вне условий.",
      "check": "Корректно организовывать случаи и отбрасывать решения вне условий.",
      "homework": "5 уравнений с модулем.",
      "targetCompetencies": []
    },
    {
      "id": "ktp-015",
      "order": 15,
      "plannedDate": "2026-11-18",
      "stageId": "legacy-stage-01",
      "stage": "Адаптация ЕГЭ",
      "block": "Рациональные уравнения",
      "topic": "Симметрия и нестандартные замены",
      "content": "Возвратные и симметричные конструкции, выделение повторяющегося выражения, рационализация структуры уравнения.",
      "result": "Распознавать замену вместо прямого раскрытия громоздких выражений.",
      "check": "Распознавать замену вместо прямого раскрытия громоздких выражений.",
      "homework": "5 уравнений на выбор замены.",
      "targetCompetencies": []
    },
    {
      "id": "ktp-016",